RECIPE_ID,RECIPE_NM_KO,SUMRY,SERVINGS,TY_NM,COOKING_TIME,LEVEL_NM,INGREDIENT_FULL,STEP_TEXT,STEP_TIP
6845981,백종원 콩나물밥 맛이 끝내줘요.,콩나물밥,3.0,밥/죽/떡,30.0,아무나,"{'쌀': '3컵', '콩나물': '300g', '굵은소금': '1/2큰술', '대파': '하얀부분 1/2대', '청양고추': '2개', '홍고추': '1/2개', '진간장': '8큰술', '설탕': '1큰술', '통깨': '1큰술', '참기름': '1/2큰술', '고춧가루': '1큰술', '다진마늘': '1작은술'}","[""1. 먼저 필요한 인원수에 맞춰 쌀을 계량하고 씻어주세요.(저흰 쌀 3컵으로 만들었어요.) 밥물을 맞춰주세요. 이때 밥물은 평소보다 약간 적게 해주세요. 평소보다 90%정도로 말이죠."", ""2. 그리고 그 밥물을 이용해서 콩나물을 데칠수 있게 물을 졸졸졸 큰 냄비에 따라부어주세요."", ""3. 따라부은 물에 굵은소금 1/2큰술을 넣어주세요. 소금을 넣어 콩나물을 데치니 콩나물에 간이 베여서 너무 맛있더라구요."", ""4. 콩나물을 깨끗이 씻어 냄비에 넣어주세요. 콩나물을 넣은 후 불을 켜주세요!!"", ""5. 콩나물을 넣자마자 냄비뚜껑을 닿고 불을 켠다음, 팔팔 물이 끓어오르면 그때부터 2분~3분이 지난다음 불을 꺼주세요. 냄비뚜껑은 절대 열었다 닫았다하시면 안됩니다. 그러면 콩나물 비린내가 날지 몰라요~"", ""6. 데친 콩나물은 넓은 접시에 건져서 식혀주세요.(콩나물 데친 물 버리시면 안됩니다!) 이렇게 넓은 접시에 펼쳐서 식혀야만 콩나물의 아삭아삭함이 남아있거든요."", ""7. 콩나물 데친물 버리지 않으셨죠?!!! ^^ 그 물을 밥솥에 넣어 밥을 할거예요."", ""8. 그러면 밥에서 콩나물향이 나서 전기밥솥에 콩나물을 넣고 밥을 한것 같거든요. 실제로 콩나물과 밥을 전기밥솥에 함께 넣어 밥을 하면 콩나물이 아삭하지 않아서 맛이 없데요."", ""9. 이제 그냥 백미로 밥을 해주시면 됩니다. 밥이 되는동안 양념장을 만들자구요~ ^^"", ""10. 먼저 대파 흰부분과 청양고추 2개, 홍고추 1/2개를 준비합니다. 모두 잘게 다져주세요~"", ""11. 설탕 1큰술, 진간장 8큰술, 참기름 1/2큰술, 통깨 1큰술, 다진마늘 1작은술, 고춧가루 1큰술을 넣어주세요."", ""12. 그리고 다진파, 다진 청양고추, 다진 홍고추를 넣어 잘 섞어주면 양념장이 완성됩니다."", ""13. 양념장 다 만들고 밥 되기만을 기다렸다가!! ㅋ 밥이 다 되면 큰 볼에 밥을 퍼서 아까 데쳐서 식혀둔 콩나물을 넣어 잘 섞어주면 됩니다."", ""14. 이렇게 해서 백종원 콩나물밥이 완성되었어요. 콩나물을 따로 데쳐서 아삭아삭한 식감이 살아있답니다.""]","["""", """", """", """", """", """", """", """", """", """", """", """", """", """"]"
6872994,"한끼로도 든든한 ""계란죽"" 간단하고 쉬워요",계란죽,2.0,밥/죽/떡,10.0,아무나,"{'계란': '2개', '참기름': '1.5T', '소금': '0.5T', '후추': '약간'}","[""1. 재료를 먼저 준비해주세요 밥 2공기, 계란2개, 참기름, 소금, 후추"", ""2. 냄비에 밥과 물반컵을 넣어 주세요! ※쌀로 하셔도 되지만 저는 항상 빠르게 하기 위해서 밥으로하는 편이에요"", ""3. 참기름 1.5T를 넣고 볶아주세요 보글보글 할때까지"", ""4. 밥이 어느정도 불었다 싶을정도로 볶아 주시면 됩니다"", ""5. 밥이 물에 잠길 정도로 물 한컵을 더 넣어 주세요"", ""6. 계란두개를 넣어서 저어 주시면 되세용"", ""7. 입맞에 맞게 소금0.5T~1T 로 간을 해주시면 됩니당"", ""8. 후추로 톡톡 마무리 해주세요^^""]","["""", """", """", """", """", """", """", """"]"
6879994,초딩입맛 제대로 저격하러 나간다~ 소떡소떡,소떡소떡,4.0,밥/죽/떡,30.0,아무나,"{'치즈떡볶이': '떡 6개', '비엔나소시지': '6개', '식용유': '넉넉히', '다진': '마늘 1/2숟가락', '고추장': '1숟가락', '올리고당': '3숟가락', '케첩': '3숟가락', '간장': '1/2숟가락', '물': '1숟가락'}","[""1. 끓는 물에 떡과 소시지를 1~2분 데친다. 치즈떡볶이 떡 6개, 비엔나소시지 6개"", ""2. 꼬치에 떡과 소시지를 번갈아 꽂는다. 꼬치"", ""3. 팬에 식용유를 넉넉히 두른 후 떡과 소시지를 튀긴다. 팬"", ""4. 팬에 양념재료를 넣어 볶아 양념장을 만든다. [양념 재료] 고추장 1숟가락, 올리고당 3숟가락, 다진 마늘 1/2숟가락, 케첩 3숟가락, 간장 1/2숟가락, 물 1숟가락 팬"", ""5. 튀긴 소시지 떡꼬치에 양념을 바른다. 꼬치"", ""6. 다진 땅콩을 뿌린다. 다진 땅콩 약간""]","[""치즈떡볶이 떡 6개, 비엔나소시지 6개"", ""꼬치"", ""팬"", ""[양념 재료] 고추장 1숟가락, 올리고당 3숟가락, 다진 마늘 1/2숟가락, 케첩 3숟가락, 간장 1/2숟가락, 물 1숟가락"", ""꼬치"", ""다진 땅콩 약간""]"
6896043,스팸 요리 추천 스팸김치볶음밥 황금레시피,스팸김치볶음밥,1.0,밥/죽/떡,30.0,아무나,"{'김치': '국물 2T', '스팸': '200g', '양파': '1/2개', '계란': '1개', '밥': '2공기', '간장': '1T', '설탕': '1/2T', '참기름': '1/2T', '볶은': '깨 1/2T'}","[""1. 김치와 양파는 굵게 썰고, 스팸은 얇게 2장을 썬 후 나머지는 먹기 좋은 크기로 썬다."", ""2. 먼저 팬에 소량의 기름을 두른 후 계란 프라이한다. 그래야 설거지를 조금이라도 덜 할 수 있다."", ""3. 얇게 썰어서 준비한 스팸을 앞뒤 노릇하게 굽는다."", ""4. 계란 프라이와 스팸을 구운 기름에 양파와 스팸을 넣어 볶는다."", ""5. 스팸이 노릇하게 익으면 김치를 넣어 볶는다."", ""6. 김치가 익기 시작하면 밥과 김치 국물 2T, 간장 1T, 설탕 1/2T를 넣어 볶고 모든 재료가 잘 섞이면 마지막에 참기름 1/2T를 넣어 마무리하면 김치볶음밥 완성."", ""7. 원하는 그릇에 김치볶음밥을 먹기 좋게 담고 그 위에 계란 프라이와 스팸을 올리면 끝.""]","["""", """", """", """", """", """", """"]"
6882208,강식당 안재현 오므라이스레시피 : 정말 맛있어요!,오므라이스,4.0,밥/죽/떡,60.0,초급,"{'밥': '1공기', '소스': '2-3큰술', '계란': '3개', '돈가스소스': '적당량', '당근': '중간크기 1개', '양파': '중간크기 1/2개', '다진': '소고기 150g', '버터': '30g', '케첩': '200ml', '우스터소스': '2/3컵', '후추': '약간'}","[""1. 먼저 오므라이스 밥과 함께 볶을 소스를 만들어볼게요! 재료는 중간 크기 당근 1개, 중간 크기 양파 1/2개, 다진 마늘 1 큰 술, 버터 30g, 케찹 200ml, 다진 소고기 150g, 우스터소스 2/3 컵 (종이컵 기준), 후추 약간이 필요하고요. 당근과 양파는 다져줍니다 :)"", ""2. 중불로 예열한 팬에 버터 30g을 넣고 잘 녹여주신 다음, 다진 마늘 1 큰 술을 넣고 잘 볶아주세요."", ""3. 마늘의 고소한 향이 올라오면 다진 소고기 150g과 후추를 적당량 넣고 잘 볶아주세요."", ""4. 소고기가 익었다 싶으면 우스터소스 2/3 컵과 케찹 200ml를 넣고 잘 볶아주세요. ** 만약 우스터소스가 없으신 분들은 간장 7 큰 술+식초 3 큰 술을 섞어 넣어주세요. (이때 신맛이 너무 강한 것 같다 하시는 분들은 요기에 설탕 1/2-1 큰 술을 추가로 넣어주세요. 그러면 신맛이 약간 덜해진답니다.) **"", ""5. 다진 양파와 당근을 넣고 한 번 더 볶아주세요."", ""6. 그러면 이렇게 소스가 완성됩니다요! 소스가 완성됐으니 이제 본격적으로 오므라이스를 만들어볼까요? ^^"", ""7. 오므라이스에 들어갈 재료는 밥 1 공기, 소스 2-3 큰 술, 돈가스 소스, 계란 3개가 필요합니다."", ""8. 중불로 예열한 팬에 밥과 소스 2-3 큰 술을 넣고 오므라이스 밥을 볶아줍니다. 소스 양은 맛을 봐가며 맞춰주세요 :)"", ""9. 접시에 밥을 올리고요. 이제 계란 프라이 반숙을 만들러 가 봅시다요!"", ""10. 강불로 예열한 팬에 식용유를 적당량 둘러준 뒤 계란 물을 붓고 스크램블 하듯이 가운데를 젓가락으로 조심스레 저어주세요. 그리고 나서 그 상태 그대로 잠시 두었다가 계란 물이 약 2/3 정도 익었을 무렵 가스불을 끄고, 볶음밥 위에 조심스레 올려준 뒤 돈가스 소스를 적당량 뿌려 맛있게 드시면 돼요!"", ""11. 좀 더 예쁘게 만들고 싶었는데, 돈가스 소스 통을 너무 세게 누르는 바람에 엉망으로 뿌려졌네요;;; 그치만 맛은 정말 최고!!! 최고!!!!! +_+ 오므라이스계의 끝판왕이라고 해도 될 정도로 정말 맛있었어요!!! 특히나 요 프라이 반숙(?)이 진짜 신의 한수!!!!"", ""12. 이웃님들도 꼭 한 번 만들어 드셔보세요!!! 아마 후회하지 않으실 거예요.""]","["""", """", """", """", """", """", """", """", """", """", """", """"]"
6844310,"떡꼬치 소스 만들기, 추억의 간식 어릴적 그 맛 그대로:)",떡꼬치,2.0,밥/죽/떡,10.0,아무나,"{'떡볶이떡': '', '고추장': '1T', '설탕': '1/2T', '다진마늘': '1/2T', '진간장': '1/2T', '올리고당': '2T', '케찹': '3T', '통깨': '팍팍'}","[""1. 집에 떡볶이 떡 다들 있으시죠 ? 떡볶이를 만들어 먹긴 하지만 생각만큼 자주 만들어 먹진 않다보니 언제나 냉동실에 한 웅큼씩 있는 것 같아요. 이쑤시개도 준비해주세요. 길이가 짧아도 상관없지만 길수록 잡고 먹기도 편하고 구울 때도 편하더라구요ㅋㅋ"", ""2. 떡볶이 떡을 끓는 물에 살짝 삶을거에요. 금방 뽑은 떡인 아닌이상 냉동실이나 냉장고에 보관해두면 떡이 딱딱해져 있잖아요 ~ 살짝 삶아서 말랑하게 해줄거에요."", ""3. 물이 팔팔 끓으면 떡을 넣고 끓여주세요. 너무 푹 삶아버리면 떡을 젓가락으로 집기만 해도 끊어질 수 있어요. 약불에 2분정도 살짝만 삶아주세요. 젓가락으로 살짝 집어보면 말랑해진 느낌이 있을거에요."", ""4. 살짝 삶은 떡을 채에 물기를 걸러준 후 말랑해진 떡을 접시에 올려두면 되는대요~ 이때 물기가 없으면 접시나 떡끼리 달라붙기 때문에 끓었던 물을 살짝 뿌려주세요~"", ""5. 꼬치에 떡을 꽂아주세요. 평평한 곳에 떡을 나열해두고 꽂아주세요. 이렇게 꽂지않으면 떡의 높이가 달라서 후라이팬에 구울 때 바닥에 안닿는 부분은 안굽히는 불상사가 ㅋㅋㅋ"", ""6. 예쁘게 모양 흐트러지지 않고 정갈한 일자의 떡꼬치 준비 됐쥬 ?"", ""7. 떡꼬치 양념을 비율대로 넣고 잘 저어주세요. 설탕 1/2T, 간마늘 1/2T, 진간장 1/2T, 올리고당 2T, 케찹 3T, 고추장 1T, 통깨 팍팍"", ""8. 새콤매콤달콤한 떡꼬치 소스 완성됐어요 :) 소스 살짝 맛보니 그래 그맛이야!!! 소스만으로도 어릴때 먹던 그 맛의 feel 팍 왔다요~"", ""9. 후라이팬에 기름을 충분히 두르고(약간 튀긴다는 느낌으로) 미리 예열 한 후 따뜻한 열기가 올라오면 떡을 구워주세요. 기름을 충분히 둘러주면 겉은 바삭하고 속은 말랑한 떡꼬치를 만들 수 있어요!"", ""10. 6.맛있게 구워진 떡은 키친타올에 올려두고 기름기를 빼주세요."", ""11. 만들어둔 소스를 떡꼬치에 슥슥 발라주세요. 브러쉬로 바르면 더 쉽겠지만 저희집엔 없어서 숟가락락으로 슥슥슥 발랐어요 :)"", ""12. 떡꼬치 만들기 성공! 주절주절 설명이 길었지만 정말 간단하면서 순식간에 맛있는 추억의 간식이 완성 됐어요 ^ㅡ^""]","["""", """", """", """", """", """", """", """", """", """", """", """"]"
6882846,신전떡볶이 레시피,신전떡볶이,2.0,밥/죽/떡,60.0,아무나,"{'떡볶이': '떡 350g', '어묵': '2장', '멸치': '다시마 육수 3컵', '모차렐라치즈': '1컵', '고추장': '3스푼', '고춧가루': '1.5스푼', '간장': '1스푼', '설탕': '2.5스푼', '카레가루': '2스푼', '후춧가루': '0.3스푼'}","[""1. 멸치 다시마 육수를 끓여줍니다 떡볶이에 필요한 육수는 3컵 정도랍니다. 끓여 놓은 육수가 남을 경우 냉장보관해 두심 되니깐요. 만들실 때 조금 넉넉하게 만들어도 좋겠지요. 국물요리에는 생수보단 육수를 사용하면 훨씬 맛있으니깐요."", ""2. 육수가 끓고 있는 동안 떡볶이 떡은 물에 씻어 주고, 어묵은 먹기 좋은 크기로 썰어 준비해 주세요. 냉동실에 보관해 두었던 떡이라면 뜨거운 물에 살짝 데쳐 사용해주세요."", ""3. 냄비에 만들어 놓은 육수 3컵 그리고 양념장인 고추장 3, 고춧가루 1.5, 간장 1, 설탕 2.5, 카레가루 2를 넣어주세요."", ""4. 양념장이 보글보글 끓어오르면"", ""5. 준비한 떡을 넣고 떡이 말랑말랑해질 때까지 끓여주세요."", ""6. 떡이 말랑해지면 어묵을 넣어줍니다."", ""7. 국물이 절반 정도 줄어들 때까지 끓여주다"", ""8. 마지막에 후춧가루를 넣어 고루 섞어 마무리해줍니다. 후춧가루 양은 본인 취향에 맞게 조절해주세요. 아이들과 함께 먹는 거라 살짝 줄였어요."", ""9. 그릇에 모차렐라치즈를 담고 전자레인지에 넣어 3분 정도 돌려 녹여주세요 전자레인지"", ""10. 녹인 치즈를 떡볶이에 부어주면 홈메이드 신전 떡볶이 완성""]","["""", """", """", """", """", """", """", """", ""전자레인지"", """"]"
6915277,김밥보다 간편하고 맛있다! 소고기 주먹밥 만들기 레시피,소고기주먹밥,2.0,밥/죽/떡,30.0,아무나,"{'쇠고기': '200g', '호박': '1/4', '파프리카': '1/4', '당근': '1/4', '양파': '1/3', '밥': '2공기', '간장': '1.5큰술', '맛술': '1큰술', '다진마늘': '1큰술', '설탕': '1큰술', '참기름': '1큰술', '후추': '', '소금': ''}","[""1. 먼저 다진 소고기에 맛술, 다진마늘, 설탕, 참기름, 후추, 소금을 넣고 밑간을 해주세요."", ""2. 고기가 잠시 재워질 동안 호박, 파프리카, 당근, 양파 등 채소를 손질해줍니다. 파프리카 손질법 레시피"", ""3. 재료준비는 벌써 끝입니다. 팬에 기름을 두르고, 손질한 채소를 볶아주세요. 너무 오래 볶지 않으셔도 되요."", ""4. 채소를 잠시 볶은 후 재워둔 소고기를 투입!"", ""5. 수분이 날아가게 강하게 졸이듯이 볶아주세요~"", ""6. 밥은 대략 두공기 정도 준비해주시고, 참기름, 소금 소량 섞어주세요."", ""7. 볶은 고기를 밥에 섞어주시고, 도시락 김 하나를 부셔서 (두개도 좋아요) 밥과 골고루 섞어줍니다."", ""8. 잘 섞인 밥, 고기, 채소를 손으로 잘 뭉쳐서 만들어주시면 됩니다."", ""9. 윤기가 나는게 먹음직스럽죠? 네 맛있습니다. ㅎㅎ"", ""10. 대신 오래 놔두면 밥이 좀 풀릴 수가 있어요. 가급적 빨리 드세요.~ 사실 찹쌀 조금 해서 섞으면 더 찰기가 있어 뭉치기 좋지만 우리는 간편한게 좋으니까 그냥 합시다 ㅎ 보기엔 귀여워보이지만 이래뵈도 두개만 먹어도 배가 든든하답니다.""]","["""", ""파프리카 손질법 레시피"", """", """", """", """", """", """", """", """"]"
6865661,소박한 정이 담긴 추억의 김치국밥,김치국밥,1.0,밥/죽/떡,15.0,아무나,"{'신김치': '1/2공기', '밥': '1/2공기', '계란': '1개', '떡국떡': '1/3공기', '멸치가루': '1스푼'}","[""1. 신김치는 송송 썰어두고 떡국떡은 물에 불려주고 찬밥 국수 준비합니다"", ""2. 멸치다싯물에 잘게썬 김치넣고 뚜껑열고 보글보글 끓이다 김치가 익을때쯤 밥 먼저 넣고"", ""3. 떡도 넣어 잠시 끓이다"", ""4. 국수도 넣어 주세요"", ""5. 국수가 눌지 않게 젓가락으로 저어가며 끓여주세요"", ""6. 간을 보고 싱거우면 새우젓이나 소금으로 간을 맞추고"", ""7. 계란1개 깨뜨려 넣어 계란이 반정도 익으면"", ""8. 김가루도 살짜기 올립니다 소박하지만 정성 가득한 김치국밥 완성""]","["""", """", """", """", """", """", """", """"]"
6835707,맛있는 동대문 엽기 떡볶이 황금레시피,엽기떡볶이,4.0,밥/죽/떡,30.0,아무나,"{'밀떡(쌀떡)': '30개', '비엔나소시지': '취향껏', '어묵': '3장', '물': '4컵', '고춧가루': '4큰술', '고추장': '1큰술', '굴소스': '1큰술', '간장': '1큰술', '설탕': '1큰술', '다진마늘': '1/2큰술', '다시다': '1큰술', '소금': '약간', '후추': '약간', '캡사이신소스': '1큰술'}","[""1. 저는 밀떡을 사서 했어요~ 엄청 쫄깃쫄깃~~ 저는 비엔나 소시지를 좋아해서 두 봉지나 넣었어요~ㅋㅋㅋ 비엔나 소시지에 칼집 좀 내주세요~ 엽기오뎅을 하고싶으시며 떡을 적게하고 어묵을 많이 해서 하면 됩니다!"", ""2. 양념장은 고춧가루 4숟갈, 고추장 1숟갈, 굴소스 1숟갈, 간장 1숟갈, 설탕 1숟갈, 다진마늘 반숟갈, 다시다 1숟갈, 소금 약간, 후추 약간, 캡사이신소스 1숟갈(더 맵게 드시고픈 분은 2숟갈!) 멸치다시마육수를 내서 하기도 하는데 귀찮아서 멸시다시마육수 대신 다시다 해봤는데 역시 다시다를 넣어야 진짜 밖에서 사먹는 동대문엽기떡볶이 맛이 나요~!!!"", ""3. 물 4컵을 넣고, 양념장을 잘 풀어주세요~! 그리고 팔팔 끓여주세요~ 한 15분정도?"", ""4. 그리고 떡이랑 어묵, 소시지를 다 넣고 중간 불로 줄여서 끓여주세요~ 쎈 불로 끓이면 어묵이랑 떡이랑 퉁퉁 불어요~ㅋㅋㅋ"", ""5. 동대문엽기떡볶이는 국물떡볶이라서 많이 졸일 필요는 없어요~ 다 넣고, 약 10분정도 더 끓이면 됩니다~!"", ""6. 완성!!!!""]","["""", """", """", """", """", """"]"
6889494,차돌박이덮밥 간단한요리,차돌박이덮밥,2.0,밥/죽/떡,10.0,초급,"{'차돌박이': '300g', '양파': '1개', '파': '1/2단', '달걀': '2개', '간장': '2', '맛술': '1', '설탕': '1/2', '다진마늘': '1/2', '올리고당': '1', '후추': '약간', '생강가루': '선택 약간'}","[""1. 우선 차돌박이 볶을 양념장부터 준비해둘께요 (일반 밥수저로 계량한거고 생강가루는 생략해도 된답니다.) 참고 : 양념은 약간 싱겁게 준비하고 볶다가 맛보면서 조절하는게 좋은거 같아요 간장2, 맛술1, 설탕1/2, 다진마늘1/2, 올리고당1, 후추약간, 생강가루약간(선택)"", ""2. 이제 차돌박이 덮밥 시작해볼께요~ 준비한 차돌박이는"", ""3. 팬에 살짝 구워서~ (정말 한번씩만 뒤집어주는 정도만 하세요. 볶을때 더 익히니까요)"", ""4. 한쪽에 꺼내두고 (고기가 크다 싶으면 조금 잘라주세요)"", ""5. 차돌박이 굽굽했던 팬에 양파와"", ""6. 차돌박이 굽굽했던 팬에 양파와 파 넣고 볶아주다가 양파가 투명해졌다 싶을때~"", ""7. 꺼내두었던 차돌박이와 준비해두었던 양념 부어서"", ""8. 샤라락 볶아주면 차돌박이 볶음 완성입니다"", ""9. 넓은접시에 밥 올리고 그위에 차돌박이볶음 올린 후 계란후라이 하나 해서 올려주면 먹음직~스런 차돌박이덮밥이 완성된답니다."", ""10. 반숙 달걀을 탁 터트려 밥이랑 차돌박이볶음이랑 함께 먹으면 부드러우면서 고소함이 입안 가득해 진답니다~ 오늘저녁 간단한요리 차돌박이덮밥 어떠세요?? ^^""]","["""", """", """", """", """", """", """", """", """", """"]"
6871038,초 간단 소고기 볶음밥,소고기볶음밥,2.0,밥/죽/떡,10.0,아무나,"{'소고기다짐육': '130g', '쥬키니호박': '1/4개', '당근': '1/2개', '대파': '1대', '밥': '2인분', '올리브유': '적당량', '맛간장': '1티스푼', '올리고당': '1티스푼', '후추': '톡톡', '맛술': '1큰술', '굴소스': '0.5큰술'}","[""1. 소고기 준비해 주고요 주키니호박,당근,대파 다져 준비해 주세요"", ""2. 팬에 소고기를 담고 맛 간장 티스푼으로 1 올리고당 티스푼으로 1 맛술 1 후추 톡톡~ 넣고"", ""3. 포슬포슬 하게 슥슥~~ 볶아줍니다"", ""4. 소고기가 다 볶아지면 준비한 야채 투하~ 올리브유 적당히 둘러주세요"", ""5. 굴소스 0.5 큰 술 넣고"", ""6. 슥슥~~ 볶아주세요"", ""7. 야채가 익음 2인 분량 밥 투하~~"", ""8. 골고루 슥슥~~ 볶아내면 끝입니다요 (마지막 부족한 간은 굴소스로 하셔도 되고요 소금 간 하셔도 됩니다 맛보시고 취향껏 조절하셔요)""]","["""", """", """", """", """", """", """", """"]"
6867669,도시락 메뉴로 최고! 깻잎쌈밥,깻잎쌈밥,1.0,밥/죽/떡,30.0,아무나,"{'깻잎': '10장', '밥': '1인분', '소금': '약간', '참기름': '1T', '캔': '참치 1/2개', '된장': '2T', '고추장': '1T', '참깨': '1T'}","[""1. 깻잎은 깨끗이 씻어 끓는 물에 소금을 넣고 약 5초 정도 익혀 낸다. 깻잎 10장"", ""2. 바로 깻잎을 찬물에 담가 식혀 낸 후 물기를 짜서 준비한다."", ""3. 밥에 소금, 참기름, 참깨를 넣어 섞는다. 밥 1인분, 소금 약간, 참기름 1T, 부순참깨 1T 참치 쌈장과 같이 먹기 때문에 소금은 아주 조금만 사용하거나 넣지 않아도 된다."", ""4. 볼에 양념 재료를 넣어 섞어 양념장을 만든다. [양념재료] 캔 참치 1/2개, 된장 2T, 고추장 1T, 참기름 1T, 부순참깨 1T 볼"", ""5. 깻잎의 뒷면이 위로 오도록 펼치고 양념장과 밥을 넣어 감싸 완성한다.""]","[""깻잎 10장"", """", ""밥 1인분, 소금 약간, 참기름 1T, 부순참깨 1T"", ""[양념재료] 캔 참치 1/2개, 된장 2T, 고추장 1T, 참기름 1T, 부순참깨 1T"", """"]"
6846842,굴소스로 뚝딱 햄야채볶음밥 만들기,굴소스햄야채볶음밥,2.0,밥/죽/떡,15.0,아무나,"{'통조림': '햄 1/2통', '호박': '1/2개', '양파': '1개', '당근': '약간', '계란': '3알', '굴소스': '2숟갈'}","[""1. 재료는 냉장고상황에 따라 준비해주시면됩니다~"", ""2. 저는 햄, 당근, 호박, 양파 준비했어요"", ""3. 팬에 기름을 두르고 계란스크램블 먼저해서 따로 덜어놓고~"", ""4. 대파를 쫑쫑 썰어 파기름을 내줍니다"", ""5. 파향이 맛있게 솔솔나면 준비한 재료를 다넣어 한번에 볶아주세요!"", ""6. 재료들이 다볶아졌다면 밥도넣어 같이 섞어주고"", ""7. 미리 만들어둔 계란스크램블도 합체!!"", ""8. 간은 굴소스로ㅋㅋㅋㅋ 간편하고 좋아요~ 만능굴소스!!!!!! 저는 2숟갈 넣었는데, 입맛에따라 굴소스양은 조절하세요"", ""9. 초스피드 간편하게 뚝딱! 완성! 미소된장국이나 계란국같은걸 곁들이면 더좋겠죠?""]","["""", """", """", """", """", """", """", """", """"]"
6837050,국물 떡볶이,국물떡볶이,1.0,밥/죽/떡,30.0,초급,"{'떡볶이떡': '2컵', '어묵': '3장', '대파': '1대', '물': '5컵', '멸치': '10마리', '다시마': '6x6 1장', '건새우': '1줌', '고추장': '2큰술', '고운고춧가루': '1큰술', '진간장': '1큰술', '설탕': '1큰술', '올리고당': '1큰술'}","[""1. 재료를 준비한 다음, 떡볶이 떡은 한가닥씩 떼어낸 후 찬물에 10분이상 담가두세요. 다시마 육수 재료를 넣고 물이 끓어오르면 다시마를 건져내고 불을 줄여 10분 이상 끓이다가 걸러주세요.(진하게 우려내 주셔야 맛이 있답니다.)"", ""2. 어묵은 길쭉한 모양으로 썰고 대파는 어슷하게 썰어주세요."", ""3. 냄비에 다시물 3컵과 양념을 넣은 후 끓어오르면 떡볶이 떡을 넣고 3~4분정도 끓여주세요."", ""4. 떡볶이 떡이 익으면 어묵과 대파를 넣고 한번 끓어오르면 국물의 농도를 맞춘 후 불을 꺼주세요.""]","["""", """", """", """"]"
6856287,"김치참치마요덮밥!/ 덮밥만들기,김치참치마요",김치참치마요덮밥,1.0,밥/죽/떡,30.0,초급,"{'밥': '1공기', '참치': '1/2캔', '계란': '2개', '김치': '조금', '김': '', '마요네즈': '1.5T', '연겨자': '0.5t', '데리야끼소스': 'or돈까스소스', '참기름': '0.5T', '설탕': '0.5T', '굴소스': '0.5T'}","[""1. 밥 1공기를 그릇에 이쁘게담아주세요"", ""2. 계란은 풀어서 스크램블에그로!"", ""3. 김치는 먹기좋게 잘라주신후 참기름1T, 굴소스0.5T와 함께 볶아주세요"", ""4. 밥 위에 계란과 김치를 얹어주세요!"", ""5. 참치는 기름기를 꾹 짠후 마요네즈1.5T, 설탕0.5T, 연겨자0.5t를 넣고 버무려주세요!"", ""6. 계란-김치-참치순으로 올려주세요"", ""7. 마지막으로 위에 마요네즈와 데리야끼 소스를 격자로 뿌려주시면 완성!""]","["""", """", """", """", """", """", """"]"
