RECIPE_ID,RECIPE_NM_KO,SUMRY,SERVINGS,TY_NM,COOKING_TIME,LEVEL_NM,INGREDIENT_FULL,STEP_TEXT,STEP_TIP
6933760,♥[신혼밥상] 팽이버섯 덮밥,팽이버섯덮밥,1.0,밥/죽/떡,10.0,아무나,"{'팽이버섯': '1봉', '대파': '1줌', '양파': '1/2개', '달걀': '1개', '참기름': '약간', '통깨': '적당히', '간장': '2숟가락', '굴소스': '0.5숟가락', '설탕': '0.5숟가락', '맛술': '2숟가락', '물': '3큰술'}","[""1. 팽이버섯은 3등분으로 자르고 양파와 대파는 채썰어주세요."", ""2. 간장 2, 맛술 2, 물 3, 굴소스 0.5, 설탕 0.5숟가락을 넣고 소스를 만들어주세요. 다진마늘 약간(커피스푼1) 넣어주면 더 맛있어요. 물론 생략가능!"", ""3. 달군팬에 기름을 두르고 대파, 양파, 팽이버섯을 넣고 숨이 죽을 만큼 살짝 볶아주세요."", ""4. 소스를 부어주세요."", ""5. 국물이 자작자작해질때까지 조려주면 완성!"", ""6. 국물이 자작해질 동안 달걀프라이 하나 ^^ 노른자 터트려 함께 비벼드시면 꿀맛!"", ""7. 밥을 담고 달걀프라이를 올린 다음 흰자 위로 팽이버섯 비~잉 참기름 톡~통깨 뿌려주면 초간단 초저렴 든든한끼 완성!""]","["""", ""다진마늘 약간(커피스푼1) 넣어주면 더 맛있어요.물론 생략가능!"", """", """", """", ""노른자 터트려 함께 비벼드시면 꿀맛!"", """"]"
6897383,스팸 돈부리덮밥!반찬이 필요없는 초간단 한그릇 요리,스팸돈부리,2.0,밥/죽/떡,2.0,아무나,"{'스팸(小)': '1캔', '양파': '1개', '계란': '2개', '대파': '약간', '간장': '4T', '설탕': '2T', '물': '2/3종이컵'}","[""1. 먼저 스팸은 스틱모양으로 썰어 뜨거운 물에 살짝 데쳐 줍니다"", ""2. 데친 스팸은 아무것도 두르지 않은채 달궈진 팬에 구워 줍니다."", ""3. 대파는 쫑쫑 썰어주시고 양파는 얇게 채 썰어 주세요 양파가 너무 크면 1/2개만 사용하세요"", ""4. 간장4스푼,설탕2스푼,물 2/3컵(종이컵)을 잘 섞어주세요. 설탕이 충분히 녹게 잘 섞어주셔요 혹시 평소 달달한것 싫어하심 설탕양은 줄여 주세요"", ""5. 계란2개를 깨서 계란물을 만들어 줍니다."", ""6. 냄비에 양파와 간장소스를 넣고 끓여 주다가 양파가 투명해지면 스팸을 위에 올려 줍니다."", ""7. 국물이 조금 자작해졌다 싶을때 계란물을 빙 둘러 주세요. 이때 마구 젓지 마시고 자연스럽게 두시면 되요. 마지막으로 대파를 솔솔 뿌려주신 뒤 완성되면 밥위에 올려주시면 끝!"", ""8. 반찬 필요없는 초간단 한그릇 요리 스팸돈부리덮밥 완성입니다.슥슥 비벼 한숟가락 먹어보니 부드러운 계란과 양파에 짭쪼름한 스팸이 만나 참 맛있네요""]","["""", """", ""양파가 너무 크면 1/2개만 사용하세요"", ""혹시 평소 달달한것 싫어하심 설탕양은 줄여 주세요"", """", """", """", """"]"
6869017,【반전의맛】스팸 양배추 덮밥 만들기~,스팸양배추덮밥,1.0,밥/죽/떡,10.0,아무나,"{'양배추': '2주먹', '양파': '1/2개', '대파': '10cm', '스팸': '100g', '땡초': '2개', '다진마늘': '1/2T', '간장': '2T', '굴소스': '1T', '참기름': '1T', '설탕': '1/2T', '후추': '2번', '물': '5T'}","[""1. 스팸200g짜리 반만 사용했어요^~^ 땡초두개,채썬양배추 두주먹,대파 10센티,양파 반개를 먹기좋게 썰어 주시구요~(애들은 땡초대신 파프리카 넣어도 맛있어요)"", ""2. 후라이팬에 기름을 두르고 대파랑 마늘 반스푼 넣어서 볶아주세요~"", ""3. 그다음 스팸을 (100g)넣고 볶다가 양파반개,땡초두개넣어서 볶아 주시구요~"", ""4. 양배추 넣어서 볶아주세요^~^이때 굴소스한스푼,간장두스푼,설탕반스푼,참기름한스푼,후추2번톡톡해서 볶아주시다가"", ""5. 물을 다섯스푼정도 넣고 볶아 주시면 완성입니다^~^"", ""6. 제가 아침겸점심겸저녁으로 먼저 먹어봤는데 너무 맛있어서 우리가족님 저녁으로 해줬더니 잡채맛이 난다고 너무 맛있다고 한그릇 뚝딱 해주시네요ㅎㅎ 정말 강력추천합니다 김치하나랑 먹어도 엄지척이에요^~^♥""]","["""", """", """", """", """", """"]"
1802633,베이컨떡꼬치,베이컨떡꼬치,2.0,밥/죽/떡,15.0,초급,"{'떡볶이떡': '', '베이컨': '', '소금': '', '블랙페이퍼(흑후추)': ''}","[""1. 떡뽁이떡, 베이컨을 준비합니다."", ""2. 떡볶이떡에 베이컨을 말아서 꼬치에 꽂아주세요."", ""3. 후라이팬에 올리브유를 두르고 소금, 후추를 가볍게 뿌린 후 약불에 천천히 노릇노릇 구워주세요."", ""4. 완성입니다.""]","["""", """", """", """"]"
6869489,매콤버섯덮밥~한그릇,버섯덮밥,1.0,밥/죽/떡,30.0,아무나,"{'느타리버섯': '80g', '양파': '60g', '대파': '1대', '밥': '1공기', '참깨': '약간', '간장': '1.5숟가락', '물': '3숟가락', '고추가루': '2숟가락', '참기름': '1/2숟가락', '설탕': '2/3숟가락'}","[""1. 느타리버섯은 길게 찢어주시고 양파는 채썰어주세요 느타리버섯대신 새송이버섯이나 다른버섯을 사용하셔도 좋아요"", ""2. 양념장재료를 섞어 양념장을 만들어주세요"", ""3. 달군팬에 대파를 넣어주세요"", ""4. 양파를 넣고 센불로 20초정도 볶아주세요"", ""5. 버섯을 넣어 1분간 더 볶아주시다가 중간불로 줄여 양념장을 넣어 볶아주세요 더 맵게 드시고 싶은 분들은 여기에 청양고추를 더 넣어주시며 되세요"", ""6. 양념장재료가 스며들도록 30초정도 볶아주신후에 그릇에 밥을 담고 밥위에 올려주신후에 참깨를 솔솔 뿌려 주세요""]","["""", """", """", """", """", """"]"
6952286,손님 초대용으로도 좋은 유산슬느낌 청경채부추새우덮밥,청경채부추새우덮밥,2.0,밥/죽/떡,15.0,초급,"{'청경채': '4뿌리', '부추': '1줌', '새우': '12마리', '버섯': '1~2줌', '양파': '1/2개', '다진마늘': '1T', '청양고추': '2개', '식용유': '3T', '굴소스': '1T', '간장': '1T', '참기름': '1T', '소금': '선택', '후추': '조금', '전분가루': '1T', '물': '250ml'}","[""1. 요리를 시작하기전에 먼저 냉동새우는 해동을 위해 한번씻어서 채에 받쳐두고 후추를 조금 뿌려줘요!"", ""2. 물 250ml(한컵)에 전분가루(전 감자전분썼어요!)녹말물도 먼저 만들어요!"", ""3. 팬에 식용유를 두르고 다진마늘 1큰술과 양파 1/2개를 볶아요!"", ""4. 양파가 조금 흐물해졌다 싶을때 해동시킨 새우를 넣어요!"", ""5. 새우가 맛있게 붉으스름해질때까지 볶아줘요"", ""6. 새우가 어느정도 익어갈때쯤 씻어놓은 청경채를 넣어줘요!"", ""7. 청경채에 숨이 죽을때까지 20초정도 볶아주다가"", ""8. 숨이 어느정도 죽으면 버섯과 굴소스 1T 간장1T를 넣고 휘리릭 볶아줍니다"", ""9. 준비했던 녹말물을 다시 잘 풀어주고 넣어주세요!"", ""10. 센불로 촤르르 볶은후 불을끄고 부추한줌과 참기름을 넣고 뒤적여주세요! 기호에따라 청양고추를 썰어주셔도 좋아요!"", ""11. 밥위에 부어주면 완성!""]","["""", """", """", """", """", """", """", """", """", """", """"]"
6886034,쫀득쫀득 일본식 감자떡 '이모모찌' 만들기,감자떡,1.0,밥/죽/떡,90.0,아무나,"{'감자': '전분 2스푼', '소금': '1꼬집', '간장': '1스푼', '올리고당': '1스푼', '맛술': '1스푼', '물': '1스푼', '버터': '1조각', '치즈': '약간'}","[""1. 감자 3개를 깍둑썰기 해주세요. 감자 3개 물에 삶아주기 이전에 익히는 시간을 단축하기 위해서 잘라주세요."", ""2. 냄비에 물을 넣고 가스렌지에 올려주세요. 물 냄비 센불"", ""3. 물이 팔팔 끓으면"", ""4. 감자를 넣어주세요."", ""5. 그 사이 소스를 만들어 줄게요. 간장 1스푼,"", ""6. 올리고당 1스푼,"", ""7. 맛술 1스푼,"", ""8. 물 1스푼을 넣고"", ""9. 잘 섞어주세요."", ""10. 감자를 젓가락으로 찔렀을 때 푹 들어가면 다 익은거랍니다."", ""11. 다 익은 감자는 체에 받쳐 물기를 빼주시고"", ""12. 보울에 넣어 매셔로 으깨주세요. 매셔 매셔가 없으시면 그냥 포크로 으깨주셔도 돼요."", ""13. 알갱이 없이 충분히 으깨주셨으면 감자전분 2스푼을 넣고"", ""14. 손으로 잘 뭉쳐주세요."", ""15. 중간에 소금 1꼬집을 넣어주세요."", ""16. 다시 잘 뭉쳐주세요. 감자전과 감자떡의 중간 질감이면 반죽 완성입니다."", ""17. 적당량을 똑 떼서 동글동글 모양을 잡아주시고 납작하게 눌러주세요. 저는 그냥 이모모찌랑 치즈 이모모찌 두 종류로 만들어 봤는데요,"", ""18. 치즈 이모모찌는 송편 만들때처럼 가운데 홈을 만들어서 그 안에 치즈를 넣어주세요. 치즈가 밖으로 나오지 않게 잘 뭉쳐서 눌러주세요."", ""19. 이렇게 저는 총 9개가 나왔어요."", ""20. 후라이팬에 버터 1스푼을 넣고 녹여주세요. 버터 후라이팬 약불"", ""21. 버터가 어느 정도 녹았으면 반죽을 올려주세요."", ""22. 양면을 노릇하게 구워주시고"", ""23. 미리 만들어둔 소스를 후라이팬에 부어주세요."", ""24. 소스가 적당히 졸어들면 완성입니당""]","[""감자 3개"", ""물"", """", """", """", """", """", """", """", """", """", ""매셔"", """", """", """", """", """", """", """", ""버터"", """", """", """", """"]"
6919305,든든한 혼밥 돈까스김치나베,돈까스김치나베,1.0,밥/죽/떡,20.0,초급,"{'돈까스': '1장', '김치': '1컵', '김치국물': '1/2컵', '고춧가루': '1스푼', '다진마늘': '1/2스푼', '국간장': '1.5~2스푼', '설탕': '1~1.5스푼', '맛술': '1스푼', '달걀': '1~2개', '물': '1/2컵'}","[""1. 돈까스 한장을 튀겨서 먹기 좋은 크기로 잘라주세요."", ""2. 뚝배기에 기름을 두르고 대파, 양파를 볶아주세요."", ""3. 김치를 넣고 볶다가 김치국물 종이컵으로 반컵정도 부어주세요."", ""4. 어느정도 볶아졌으면 고춧가루 1스푼, 다진마늘 반스푼, 국간장 2스푼, 설탕 한스푼 반, 종이컵으로 물 반컵을 넣고 끓여주세요. 평소에 싱겁게 드시거나 덜 달게 드신다면 국간장은 1.5스푼, 설탕은 1스푼 추천드려요."", ""5. 국물이 자작자작해지면 돈까스를 올려주세요."", ""6. 달걀 1~2개를 풀어 가장자리에 빙빙 둘러주세요. 데코로 대파 올리면 든든한 한끼식사 완성! 팽이버섯을 추가해 주면 좋을 것 같습니다.""]","["""", """", """", ""평소에 싱겁게 드시거나 덜 달게 드신다면 국간장은 1.5스푼, 설탕은 1스푼 추천드려요."", """", ""팽이버섯을 추가해 주면 좋을 것 같습니다.""]"
6892728,간단한 한끼식사ㅡ 삼색소보로덮밥,삼색소보로덮밥,2.0,밥/죽/떡,15.0,초급,"{'신김치': '1밥그릇', '계란': '2개', '통조림햄': '200g', '양파': '1/2개', '식용유': '1T', '올리고당': '2T', '참기름': '1T', '소금': '1꼬집', '깨소금': '적당량'}","[""1. 신김치 밥그릇1을 준비합니다 가위로 먹기좋게 잘라주세요"", ""2. 양파 반개를 잘게 썰어서 준비합니다"", ""3. 계란2개를 미리 풀어놓아요 소금 한꼬집만 넣어어요"", ""4. 햄200g도 먹기좋은 크기로 썰어주세요"", ""5. 햄은 아무것도 넣지않고 살짝 구워주세요"", ""6. 계란은 스크램블을 합니다"", ""7. 팬에 기름1을 두르고 김치와 양파를 볶아주세요"", ""8. 올리고당 2T를 넣고 살짝 볶아주세요"", ""9. 불을 끄고 참기름1을 넣어 섞어주세요"", ""10. 밥1공기를 그릇에 담아줍니다"", ""11. 세가지 토핑을 차례로 올려주면 완성""]","["""", """", """", """", """", """", """", """", """", """", """"]"
6878340,단짠단짠의 대패덮밥,대패덮밥,2.0,밥/죽/떡,30.0,초급,"{'대패': '삼겹살 400g', '대파': '2뿌리', '설탕': '2스푼', '맛간장': 'OR진간장 4스푼'}","[""1. 궁중팬에 대패삼겹살을 넣어줍니다. 대패삼겹살 400g"", ""2. 대파는 큼직하게 썰어서 준비합니다. 대파 2뿌리"", ""3. 대패삼겹살이 골고루 익도록 볶아줍니다. 강불"", ""4. 고기가 적당히 익으면 준비한 대파를 넣고 좀더 볶아줍니다. 강불"", ""5. 대패삼겹살이 노릇해질 정도로 충분히 익혀준 뒤 중불"", ""6. 설탕 2스푼을 넣고 한번 더 볶아줍니다. 설탕 2스푼 중불"", ""7. 설탕을 넣고 볶아주면 고기에 윤기가 돌아요. 중불 설탕을 넣을 때는 불을 중불로 줄여야 타지않게 볶을 수 있어요."", ""8. 맛간장 또는 진간장을 4큰술 넣고 한번 더 볶아줍니다. 중불 입맛에 따라 간장의 양은 조절해야 해요!"", ""9. 삼겹살에 간장 양념이 골고루 베이도록 볶아주면 완성이에요^^"", ""10. 오목한 그릇에 따뜻한밥을 담고, 그 위에 볶은 고기를 올려주면 대패덥밥 완성!""]","[""대패삼겹살 400g"", ""대파 2뿌리"", ""강불"", ""강불"", ""중불"", ""설탕 2스푼"", ""중불"", ""중불"", """", """"]"
6867650,다른 반찬이 필요없는 매운 어묵 비빔밥~*,어묵비빔밥,2.0,밥/죽/떡,15.0,아무나,"{'사각어묵': '3장', '땡초': '2', '통마늘': '3', '고추장': '1.5큰술', '굴소스': '1', '올리고당': '1', '고춧가루': '1', '후추': '톡', '통깨': '솔솔', '올리브유': '조금', '맛술': '1', '참기름': '0.5큰술'}","[""1. 어묵 땡초 다져주시고 통마늘 듬성듬성 다져주세요"", ""2. 팬에 위 준비한 재료를 넣고 맛술 1 숟가락 고추장 1.5 숟가락 굴소스 1 숟가락 올리고당 1 숟가락 통깨 솔솔 넣어준다"", ""3. 휘리릭~ 볶아주다가 고춧가루 1 숟가락"", ""4. 대파 조금 후추 톡~ 넣고 볶아주세요"", ""5. 마지막 오일을 조금 두르고 슥슥슥~~~ 볶아"", ""6. 그릇에 담아 내심 끝 이때 참기름 티스푼 1 정도 넣고 비벼 먹어요""]","["""", """", """", """", """", """"]"
6930961,양배추 참치덮밥 /Cabbage tuna bowl of rice,양배추참치덮밥,1.0,밥/죽/떡,20.0,아무나,"{'참치캔': '100g', '양배추': '170g', '양파': '1/2개', '대파': '1대', '식용유': '2Ts', '쌀밥': '180g', '고춧가루': '1Ts', '고추장': '1Ts', '올리고당': '1Ts', '굴소스': '1Ts'}","[""1. 참치캔은 기름을 제거한다."", ""2. 양배추는 사각으로 잘라 준다."", ""3. 양파는 사각으로 잘라 준다."", ""4. 대파는 송송 썰어 준다."", ""5. 프라이팬에 식용유, 대파를 넣고 향이 날 때까지 볶는다."", ""6. 대파의 향이 나면 양배추를 넣고 볶는다."", ""7. 양파를 넣고 볶는다."", ""8. 고춧가루, 고추장, 참치, 올리고당, 굴 소스를 넣고 볶는다."", ""9. 그릇에 밥을 담아 준비한다."", ""10. 밥위에 덮밥소스를 올려준다.""]","["""", """", """", """", """", """", """", """", """", """"]"
6935331,삼겹깐풍덮밥 : 비 오는 날에 생각나는 삼겹살!!!! 실패없는 깐풍소스로 덮밥만들기 ♥,삼겹깐풍덮밥,2.0,밥/죽/떡,30.0,초급,"{'삽겹살': '2줄', '홍고추': '2개', '청양고추': '2개', '양파': '1/4개', '쪽파': '2줄', '다진': '생강 1/2숟가락', '밥': '1공기', '식용유': '약간', '간장': '3숟가락', '식초': '2숟가락', '물': '2숟가락', '설탕': '1숟가락', '후추': '약간'}","[""1. 양파는 작게 다지고 홍고추, 청양고추, 쪽파는 송송 썬다."", ""2. 삽겹살은 잘게 자른 후 팬에 기름을 두르고 노릇하게 굽는다. 팬 에어프라이어에 조리 시 180도 온도에서 10분간 조리해주세요."", ""3. 팬에 기름을 두른 후 다진 마늘, 다진 생강을 볶다가 양념 재료, 다진 양파, 송송 썬 홍고추, 청양고추를 넣고 볶는다. 팬"", ""4. 양념이 살짝 끓어 오르면 구운 삼겹살을 넣고 볶아 삼겹 깐풍을 만든다."", ""5. 그릇에 밥을 담고 삼겹 깐풍을 올린 후 송송 썬 쪽파를 뿌려 완성한다. 그릇""]","["""", ""팬"", ""팬"", """", ""그릇""]"
6891556,스팸 양파덮밥/스팸 돈부리,스팸양파덮밥,1.0,밥/죽/떡,10.0,초급,"{'양파': '1개', '스팸': '2슬라이스', '계란': '1개', '다진마늘': '1스푼', '파': '적당량', '참깨': '적당량', '간장': '2스푼', '설탕': '1스푼', '맛술': '2스푼', '물': '6스푼'}","[""1. 슬라이스한 스팸 2조각을 끓는물에 살짝 데쳐주세요. 짠맛도 줄어들고 기름기가 빠져 맛이 깔끔해져요."", ""2. 먹기 적당한 크기로 썰어 후라이팬에 구워주세요."", ""3. 양파 1개를 채썬 후 다진마늘 1스푼을 넣고 살짝 볶아주세요."", ""4. 양념재료인 간장 2스푼, 설탕 1스푼, 맛술 2스푼, 물 6스푼을 넣고 약한 불에서 끓여주세요."", ""5. 양파가 흐물해지기 시작하면 구운 스팸을 넣고 살짝만 더 끓여주세요"", ""6. 계란 1개를 풀어 파를 적당량 썰어 넣고 그위에 부어 주세요. 살짝 덜 익은 반숙인 상태에서 불을 꺼주세요. 반숙 상태인 계란은 촉촉하면서도 부드러운 맛을 느끼게 해줘요."", ""7. 밥 위에 스팸 양파덮밥을 올리고 참깨를 솔솔 뿌려주면 완성!!""]","[""짠맛도 줄어들고 기름기가 빠져 맛이 깔끔해져요."", """", """", """", """", """", """"]"
6886567,딱 10분이면 완성! 초간단 애호박덮밥,애호박덮밥,1.0,밥/죽/떡,10.0,아무나,"{'밥': '1공기', '애호박': '1/2개', '양파': '1/3개', '기름': '1T', '고추기름': '1T', '다진파': '1줌', '참기름': '1t', '고춧가루': '1T', '고추장': '0.5T', '간장': '2T', '물': '2T', '굴소스': '1T', '다진마늘': '0.5T', '후추': '톡톡'}","[""1. 양파와 애호박은 채 썰어 준비해 주세요. 양파 1/3개, 애호박 1/2개 전 애호박을 넉넉하게 준비했어요~ 취향껏 양을 조절해주세요."", ""2. 분량의 양념 재료를 섞어 양념장을 만들어 주세요. 고춧가루 1T, 고추장 0.5T, 간장 2T, 물 2T, 굴소스 1T, 다진마늘 0.5T, 후추 톡톡 양념 재료는 취향에 따라 가감해주세요."", ""3. 팬에 기름 1T, 고추기름 1T를 넣고 다진파 한줌 넣어 약불에서 파기름을 만들어 주세요. 기름 1T, 고추기름 1T, 다진파 한줌 약불 고추기름이 없다면 그냥 기름을 사용하셔도 좋아요."", ""4. 파향이 올라오면 센불로 올리고 양파와 애호박을 넣어 약 2-3분간 볶아주세요. 양파, 애호박 센불"", ""5. 그 다음 양념장을 넣어 약 2-3분간 볶아주세요. 양념장 센불 양념장이 튈 수 있으니 조심하세요. 양념장은 넣기 전에 맛을 보고 너무 짜다 싶으면 다 넣지 말고 입맛에 맞게 넣어주세요."", ""6. 채소가 다 익으면 불을 끄고 마무리로 참기름 1t를 넣으면 완성입니다. 참기름 1t 혹시 부족한 간은 소금으로 맞춰주세요."", ""7. 그릇에 밥과 애호박볶음을 올리고 취향에 따라 달걀후라이를 하나 함께 곁들이시면 완성업니다:)""]","[""양파 1/3개, 애호박 1/2개"", ""고춧가루 1T, 고추장 0.5T, 간장 2T, 물 2T, 굴소스 1T, 다진마늘 0.5T, 후추 톡톡"", ""기름 1T, 고추기름 1T, 다진파 한줌"", ""양파, 애호박"", ""양념장"", ""참기름 1t"", """"]"
6832044,"여름엔 진리, ""참치오이롤초밥""♪",참치오이롤초밥,1.0,밥/죽/떡,30.0,아무나,"{'오이': '1개', '밥': '1공기', '참치': '1캔 100g 1캔', '양파': '1/4개', '마요네즈': '4스푼', '설탕': '1스푼', '소금': '1꼬집', '깨': '조금'}","[""1. 참치캔을 따서 기름을 제거하고 그릇에 담은 다음, 숟가락으로 으깨줍니다."", ""2. 양파 4분의 1조각도 다져서 준비하구요~"", ""3. 으깬 참치에 양파를 넣고 분량의 양념을 넣어줍니다."", ""4. 그리고 잘 섞어주세요~ 이러면 참치 샐러드 완성인데요.. 이건 숟가락으로 그냥 퍼먹어도 맛나답니다."", ""5. 오이는 흐르는 물에 깨끗이 씻은후 필러를 이용해서 포를 떠듯이 한겹 한겹 벗겨내줍니다."", ""6. 오이에 필러대면 부드럽게~ 한번에 벗겨진답니다."", ""7. 밥1공기도 준비해주고요, 그냥 사용해도 무방하나 참기름, 소금으로 살짝 간해주면 더 맛있게 먹을 수 있어요."", ""8. 도마위에 오이를 펼쳐놓고 주먹밥을 만들듯 밥을 뭉쳐서 오이 너비에 맞춰 손으로 빚고 올려줍니다."", ""9. 그리고 돌돌 말아주세요."", ""10. 오이 수분으로 인해 자동접착이 되니 그냥 말아주기만 하면 되구요~ 이렇게 놔두면 오이롤초밥 완성인데요~"", ""11. 더 맛있게 먹기 위해 참치샐러드를 올려주어 참치오이롤초밥을 완성합니다.""]","["""", """", """", """", """", """", """", """", """", """", """"]"
6842114,"팽이버섯덮밥:초초초간단 그러나, 더 없이 훌륭한 한끼",팽이버섯덮밥,2.0,밥/죽/떡,10.0,아무나,"{'팽이버섯': '1봉', '양파': '1개', '대파': '약간', '계란': '2개', '참기름': '약간', '통깨': '약간', '식용유': '약간', '후추': '약간', '양조간장': '2T', '맛술': '2T', '육수': 'or물 2T'}","[""1. -달군 팬에 식용유 약간 두르고 굵게 채썬 양파를 볶는다"", ""2. -팽이버섯은 밑둥 잘라내고 가볍게 헹궈 물기를 짜내고 3-4등분 한다"", ""3. -팽이버섯을 볶다가 숨이 죽으면 양조간장+맛술+육수(물)을 넣어 조린다"", ""4. 그릇에 따뜻한 밥을 담고-> 그 위에 계란프라이를 올리고->계란흰자 위로 팽이버섯조림 돌려담고-> 마지막에 참기름을 한두방울 떨어뜨려준다""]","["""", """", """", """"]"
6839363,게살 텐신항:중국식?일본식? 어쨌든 초간단! 계란덮밥,계란덮밥,1.0,밥/죽/떡,15.0,초급,"{'밥': '1공기', '물': '200ml', '양조간장': '1큰술', '스톡': '이나 굴소스 1/3큰술', '맛술': '1큰술', '전분': '1큰술', '식초': '1큰술', '계란': '2개', '크래미맛살': '3~4개', '다진파': '약간', '소금': '약간', '식용유': '약간'}","[""1. -냄비나 웍에 물200밀리,양조간장1큰술,야채스톡1/3큰술,전맛술1,분1큰술,설탕1큰술을넣고 거품이로 재료가 잘 섞이도록 저어준다 *야채스톡 대신 치킨스톡이나 굴소스,이도저도 없으면 국간장을 반숟갈 넣어주면 됩니다"", ""2. -불을 켜고 소스를 끓이는데 중간중간 전분이 뭉치지 않도록 저어주어야 한다"", ""3. -소스가 다 끓으면 식초를 넣고 불을 끈다"", ""4. -크래미맛살을 찢어넣고 계란에 소금 약간 뿌려 계란물을 만든다"", ""5. -팬에 식용유를 두르고 계란물을 붓은 후 다진파를 넣어 약불에서 익힌다"", ""6. -계란이 익기 시작하면스크램블드에그 하듯이 젓가락으로 휘~휘~왔다갔다 계란물을 섞어준 후 완전히 익기 전에 불을 끈다"", ""7. -밥을 접시에 담는다 *밥을 그릇이나 모양틀에 눌러 담으면 좋아요"", ""8. -계란부침을 밥 위에 얹는다"", ""9. -소스를 계란 위에 넉넉히 뿌린다""]","["""", """", """", """", """", """", """", """", """"]"
6895266,No밀가루!속이 편안 밥피자 만들기,밥피자,2.0,밥/죽/떡,30.0,아무나,"{'밥': '1공기', '계란': '1개', '버터': '1T', '양파': '1/2개', '피망': '1/2개', '햄': '1/2캔', '피자치즈': '1봉', '파슬리가루': '톡톡', '토마토스파게티소스': '적당히'}","[""1. 먼저 야채와 햄을 잘게 썰어 준 뒤 달궈진 팬에 식용유 약간 둘러 볶아 줍니다."", ""2. 밥에는 계란1개를 깨서 잘 섞어 둡니다."", ""3. 달궈진 팬에 버터 1스푼을 둘러 녹여 주시구요 약불"", ""4. 계란 섞은 밥을 넓게 펴서 올린 뒤 이 상태로 타지않게 약불에서 3분정도 익혀줍니다. 약불"", ""5. 밥이 어느정도 익으면 볶아둔 재료 올리고 스파게티 소스를 얇게 발라 줍니다. 불은 계속 약불 유지!"", ""6. 피자치즈, 파슬리가루를 뿌린뒤 뚜껑을 덮어 약불에서 치즈 녹여주시면 끝! 타지 않게 약불에서 치즈를 녹여 주셔요."", ""7. 밀가루가 없어 속이 편한 밥피자 완성입니다!"", ""8. 한조각 먹어보니 밥은 약간 누룽지처럼 바삭하면서 야채,햄, 고소한 치즈가 어우러져 진짜 맛있어요! 밀가루 없어 속이 편하면서도 든든해서 한끼 식사대용으로도 좋아요""]","["""", """", ""약불"", ""약불"", ""불은 계속 약불 유지!"", ""타지 않게 약불에서 치즈를 녹여 주셔요."", """", """"]"
